<?xml version="1.0" encoding="UTF-8"?>
<project xmlns:xsi="http://www.w3.org/2001/XMLSchema-instance" xsi:noNamespaceSchemaLocation="../schemas/project-page.xsd">

    <title>NASA Psyche Mission: AR/WebXR for Public Engagement—CERNN: Lore and Mythology Experience</title>

    <stages>
        <!-- Stage: Description -->
        <stage>
            <title>Project Overview</title>

            <section-description>
                <title>Project Overview</title>
                <description>The project outlines an interactive Augmented Reality (AR) experience designed to educate the general public about NASA’s Psyche mission by blending real-world astronomical discovery with its namesake Greek mythology.</description>
            </section-description>

            <section>
                <title>Core Themes &amp; Mythological Connections</title>
                <items>
                    <item>
                        <subsection-title>The Asteroid (Psyche 16)</subsection-title>
                        <detail>Likened to a chrysalis in Greek myth, the asteroid represents a planetary "soul" whose failure to become a full planet mirrors the goddess Psyche falling into a deep sleep.</detail>
                    </item>
                    <item>
                        <subsection-title>The Spacecraft</subsection-title>
                        <detail>The spacecraft's butterfly-like solar panels symbolize the "breath of life," framing its scientific mission as a way to grant the asteroid immortality.</detail>
                    </item>
                </items>
            </section>

            <section>
                <title>The AR Experience Flow</title>
                <items>
                    <item>
                        <subsection-title>Part 1: Historical Discovery &amp; Mythos</subsection-title>
                        <detail>Users play as an 1852 astronomer using an interactive AR telescope to discover the asteroid before viewing rotatable 3D videos that explain its mythological connections.</detail>
                    </item>
                    <item>
                        <subsection-title>Part 2: Modern Launch &amp; Exploration</subsection-title>
                        <detail>Users watch the 2023 spacecraft launch and travel through space while an animated winged overlay connects the modern scientific journey to the goddess's myth.</detail>
                    </item>
                </items>
            </section>

            <section>
                <title>Development Challenges &amp; Accessibility</title>
                <items>
                    <item>
                        <subsection-title>Obstacles</subsection-title>
                        <detail>The primary challenge is designing and building the complex 3D AR models required for the historical telescope, the mythological figures, and the rocket launch.</detail>
                    </item>
                    <item>
                        <subsection-title>Accessibility</subsection-title>
                        <detail>The highly inclusive app will feature intuitive gesture controls, written text, full audio descriptions, and a dedicated audio-only mode for visually impaired users.</detail>
                    </item>
                </items>
            </section>
        </stage>

        <!-- Stage: Requirements & Design -->
        <stage>
            <title>Requirements &amp; Design</title>

            <section-description>
                <title>Core Functional Requirements</title>
                <description>Refined Sponsor requirements to the creation of a two-phase, gamified mythological experience about the Psyche asteroid and spacecraft that integrates interactive discovery mechanics, lore-driven vector graphics, and comprehensive UI/UX designs.</description>
            </section-description>

            <section>
                <title>The Asteroid Mythos Phase (AMP)</title>
                <items>
                    <item>
                        <detail>The Asteroid Mythos Phase gamifies the historical discovery by having users search for the asteroid within a timed Skybox using a virtual telescope.</detail>
                    </item>
                    <item>
                        <detail>A lore section follows that uses glowing, constellation-style vector images to connect the asteroid's nature to a chrysalis and the sleeping goddess Psyche.</detail>
                    </item>
                </items>
            </section>
            <section>
                <title>The Spacecraft Mythos Phase (SMP)</title>
                <items>
                    <item>
                        <detail>The Spacecraft Mythos Phase covers the modern mission by displaying the spacecraft's launch and an arrival timer.</detail>
                    </item>
                    <item>
                        <detail>Butterfly vector graphics to symbolize the "Breath of Life" and framing the scientific documentation as a way for the goddess to achieve immortality.</detail>
                    </item>
                </items>
            </section>
            <section>
                <title>UI/UX Mockup Development</title>
                <items>
                    <item>
                        <detail>Designed and delivered comprehensive UI mockups for the launch interface, settings menu, interactive dialog boxes, and help screens to establish the visual language and user flow.</detail>
                    </item>
                </items>
            </section>
        </stage>

        <!-- Stage Sprint 6: System Architecture &amp; Frontend Implementation -->

        <stage>
            <title>System Architecture &amp; Frontend Implementation</title>
            <section-description>
                <title>Sprint Objectives &amp; Execution</title>
                <description>Architected system flows and engineered the foundational frontend elements for the second phase of the gamified lore experience, translating comprehensive UI/UX mockups into interactive user features.</description>
            </section-description>

            <section>
                <title>System Architecture &amp; Flow Design</title>
                <items>
                    <item>
                        <detail>Architected a detailed, low-level user experience flow derived from high-level requirements to accurately map the narrative progression of the asteroid lore.</detail>
                    </item>
                    <item>
                        <detail>Developed comprehensive UML Activity Diagrams to visualize the application architecture and strictly guide the frontend engineering lifecycle.</detail>
                    </item>
                </items>
            </section>

            <section>
                <title>UI/UX Design &amp; Asset Prototyping</title>
                <items>
                    <item>
                        <detail>Designed high-fidelity mockups for the core application screens, including the main dashboard and launch page, establishing the visual aesthetic of the Psyche lore experience.</detail>
                    </item>
                    <item>
                        <detail>Created standardized interface assets, including thematic papyrus scroll graphics, help screens, and settings menus, utilizing component-driven design patterns to maximize asset reusability.</detail>
                    </item>
                </items>
            </section>

            <section>
                <title>Frontend Engineering &amp; Core Mechanics</title>
                <items>
                    <item>
                        <detail>Implemented responsive frontend views for the primary experience pages, seamlessly translating conceptual UI designs into functional web components.</detail>
                    </item>
                    <item>
                        <detail>Engineered the foundational logic and interactive scope for the core "finding feature" mechanic on the main page to actively drive user discovery and engagement.</detail>
                    </item>
                </items>
            </section>
        </stage>

        <!-- Stage Sprint 7: Implementation & Asset Development -->
        <stage>
            <title>Implementation &amp; Asset Development</title>

            <section-description>
                <title>Sprint Objectives &amp; Execution</title>
                <description>Executed the development of the Asteroid Mythos Phase (AMP) by engineering an interactive mobile-compatible telescope search mechanic, designing realistic 3D and 2D environmental assets, and implementing responsive UI/UX control popups to seamlessly guide the user's lore experience.</description>
            </section-description>

            <section>
                <title>Interactive Discovery Mechanics</title>
                <items>
                    <item>
                        <detail>Engineered a mobile-compatible search mechanic that dynamically randomizes the asteroid's location, keeping it hidden from view until successfully aligned within the interactive telescope.</detail>
                    </item>
                    <item>
                        <detail>Programmed fluid star-moving animations and automated state transitions that trigger immediately upon the user's discovery of the meteorite.</detail>
                    </item>
                </items>
            </section>
            <section>
                <title>Environmental &amp; Mythological Asset Design</title>
                <items>
                    <item>
                        <detail>Enhanced the graphical fidelity of the main page by integrating a realistic 3D asteroid model alongside a rich, multi-layered 2D environment featuring a Naples observatory, grassy terrain, and foreground telescope.</detail>
                    </item>
                    <item>